{
  "schema_version": 1,
  "generated": "2026-10-12T08:45:20+02:00",
  "source": "stroomvoorspeller.nl",
  "docs": "https://stroomvoorspeller.nl/home-assistant",
  "license": "CC-BY 4.0",
  "price_unit": "EUR/kWh",
  "timezone": "Europe/Amsterdam",
  "price_types": {
    "market": "Kale EPEX day-ahead marktprijs in EUR/kWh, excl. belasting en leverancieropslag.",
    "all_in": "Indicatieve consumentenprijs in EUR/kWh incl. btw: (market + gemiddelde leverancieropslag + energiebelasting) x btw. Voor je exacte prijs: vervang de gemiddelde opslag door die van je eigen leverancier."
  },
  "tax": {
    "energy_tax_per_kwh": 0.0916,
    "vat_factor": 1.21,
    "average_markup_per_kwh": 0.017,
    "year": 2026
  },
  "today": {
    "date": "2026-10-12",
    "complete": true,
    "hours_count": 24,
    "average_market": 0.19706,
    "average_all_in": 0.36985,
    "cheapest": {
      "start": "2026-10-12T13:00:00+02:00",
      "market": 0.14227,
      "all_in": 0.30355
    },
    "most_expensive": {
      "start": "2026-10-12T19:00:00+02:00",
      "market": 0.27953,
      "all_in": 0.46964
    },
    "negative_hours": 0,
    "negative_hours_market": 0,
    "negative_hours_all_in": 0,
    "hours": [
      {
        "start": "2026-10-12T00:00:00+02:00",
        "market": 0.17828,
        "all_in": 0.34712
      },
      {
        "start": "2026-10-12T01:00:00+02:00",
        "market": 0.17219,
        "all_in": 0.33976
      },
      {
        "start": "2026-10-12T02:00:00+02:00",
        "market": 0.168,
        "all_in": 0.33469
      },
      {
        "start": "2026-10-12T03:00:00+02:00",
        "market": 0.16589,
        "all_in": 0.33213
      },
      {
        "start": "2026-10-12T04:00:00+02:00",
        "market": 0.16548,
        "all_in": 0.33164
      },
      {
        "start": "2026-10-12T05:00:00+02:00",
        "market": 0.1784,
        "all_in": 0.34727
      },
      {
        "start": "2026-10-12T06:00:00+02:00",
        "market": 0.21935,
        "all_in": 0.39682
      },
      {
        "start": "2026-10-12T07:00:00+02:00",
        "market": 0.25718,
        "all_in": 0.44259
      },
      {
        "start": "2026-10-12T08:00:00+02:00",
        "market": 0.2635,
        "all_in": 0.45024
      },
      {
        "start": "2026-10-12T09:00:00+02:00",
        "market": 0.22153,
        "all_in": 0.39946
      },
      {
        "start": "2026-10-12T10:00:00+02:00",
        "market": 0.1916,
        "all_in": 0.36324
      },
      {
        "start": "2026-10-12T11:00:00+02:00",
        "market": 0.17,
        "all_in": 0.33711
      },
      {
        "start": "2026-10-12T12:00:00+02:00",
        "market": 0.1516,
        "all_in": 0.31484
      },
      {
        "start": "2026-10-12T13:00:00+02:00",
        "market": 0.14227,
        "all_in": 0.30355
      },
      {
        "start": "2026-10-12T14:00:00+02:00",
        "market": 0.14653,
        "all_in": 0.30871
      },
      {
        "start": "2026-10-12T15:00:00+02:00",
        "market": 0.1579,
        "all_in": 0.32247
      },
      {
        "start": "2026-10-12T16:00:00+02:00",
        "market": 0.1813,
        "all_in": 0.35078
      },
      {
        "start": "2026-10-12T17:00:00+02:00",
        "market": 0.23153,
        "all_in": 0.41156
      },
      {
        "start": "2026-10-12T18:00:00+02:00",
        "market": 0.272,
        "all_in": 0.46053
      },
      {
        "start": "2026-10-12T19:00:00+02:00",
        "market": 0.27953,
        "all_in": 0.46964
      },
      {
        "start": "2026-10-12T20:00:00+02:00",
        "market": 0.25041,
        "all_in": 0.4344
      },
      {
        "start": "2026-10-12T21:00:00+02:00",
        "market": 0.2,
        "all_in": 0.37341
      },
      {
        "start": "2026-10-12T22:00:00+02:00",
        "market": 0.18737,
        "all_in": 0.35812
      },
      {
        "start": "2026-10-12T23:00:00+02:00",
        "market": 0.17766,
        "all_in": 0.34637
      }
    ],
    "available": true
  },
  "tomorrow": {
    "date": "2026-10-13",
    "available": false
  },
  "forecast": {
    "available": true,
    "model_version": "5.0",
    "disclaimer": "Modelvoorspelling met onzekerheid — géén day-ahead feit. Gebruik dit niet voor automatiseringen die op exacte prijzen rekenen; gebruik daarvoor 'today' en (na ~14:00) 'tomorrow'.",
    "days": [
      {
        "date": "2026-10-13",
        "days_ahead": 1,
        "average_market_estimate": 0.15544,
        "lower": 0.11075,
        "upper": 0.20013,
        "negative_probability": 0.0
      },
      {
        "date": "2026-10-14",
        "days_ahead": 2,
        "average_market_estimate": 0.17233,
        "lower": 0.12126,
        "upper": 0.2234,
        "negative_probability": 0.0
      },
      {
        "date": "2026-10-15",
        "days_ahead": 3,
        "average_market_estimate": 0.1627,
        "lower": 0.11079,
        "upper": 0.2146,
        "negative_probability": 0.0
      },
      {
        "date": "2026-10-16",
        "days_ahead": 4,
        "average_market_estimate": 0.16425,
        "lower": 0.10909,
        "upper": 0.21941,
        "negative_probability": 0.0
      },
      {
        "date": "2026-10-17",
        "days_ahead": 5,
        "average_market_estimate": 0.13179,
        "lower": 0.08185,
        "upper": 0.18174,
        "negative_probability": 0.0
      },
      {
        "date": "2026-10-18",
        "days_ahead": 6,
        "average_market_estimate": 0.13149,
        "lower": 0.08162,
        "upper": 0.18137,
        "negative_probability": 0.04
      },
      {
        "date": "2026-10-19",
        "days_ahead": 7,
        "average_market_estimate": 0.19306,
        "lower": 0.1278,
        "upper": 0.25833,
        "negative_probability": 0.0
      }
    ]
  }
}
